Entity-Long,Entity,Combined,Show,Group,Sub-Group,UN Principal Organ,Category,CEB Member?,Head of Entity-Level,Head of Entity-Title,Head of Entity-Name,Entity URL,Comment,description,annual_report_link,transparency_portal_link,Organizational Chart
Office of Information and Communications Technology,OICT,Office of Information and Communications Technology (OICT),Yes,UN Secretariat,,Secretariat,Departments and Offices,No,ASG or equivalent,CITO,Bernardo Mariano Jr.,https://unite.un.org/,,"The OICT defines the strategic direction for ICT to the Secretariat. It provides oversight of ICT programmes, budgets and decision-making to ensure alignment with the Secretariat’s overall ICT strategy.",https://www.un.org/annualreport/,,
Office of Internal Oversight Services,OIOS,Office of Internal Oversight Services (OIOS),Yes,UN Secretariat,,Secretariat,Departments and Offices,No,USG or equivalent,USG,Fatoumata Ndiaye,https://oios.un.org/,,"The OIOS assists the Secretary-General in fulfilling his oversight responsibilities in respect of the resources and staff of the Organization through the provision of audit, investigation, inspection and evaluation services.",https://oios.un.org/annual-reports,,
Office of Legal Affairs,OLA,Office of Legal Affairs (OLA),Yes,UN Secretariat,,Secretariat,Departments and Offices,No,USG or equivalent,USG/Legal Counsel,Elinor Jane Britt Hammarskjöld,https://legal.un.org/ola/,,OLA provides a unified central legal service for the Secretariat and other entities of the United Nations and contributes to the progressive development and codification of international public and trade law.,https://legal.un.org/ola/publications.aspx,,
Office of the United Nations Ombudsman and Mediation Services,OMS,Office of the United Nations Ombudsman and Mediation Services (OMS),Yes,UN Secretariat,,Secretariat,Departments and Offices,No,ASG or equivalent,Ombudsman,Shireen Dodson,https://www.un.org/ombudsman/,,,,,
Office for Outer Space Affairs,OOSA,Office for Outer Space Affairs (OOSA),Yes,UN Secretariat,,Secretariat,Departments and Offices,No,D-2 or equivalent,Director,Aarti Holla-Maini,https://www.unoosa.org/,,UNOOSA is responsible for promoting international cooperation in the peaceful uses of outer space. It serves as the secretariat for the General Assembly's only committee dealing exclusively with international cooperation in the peaceful uses of outer space.,https://www.unoosa.org/oosa/en/aboutus/annual-reports.html,,
Office of the Special Adviser on Africa,OSAA,Office of the Special Adviser on Africa (OSAA),Yes,UN Secretariat,,Secretariat,Departments and Offices,No,USG or equivalent,Special Adviser,Cristina Isabel Lopes da Silva Monteiro Duarte,https://www.un.org/osaa/,,"The OSAA strives for coordinated, effective and sustained UN and international support for Africa’s transformative efforts for inclusive sustainable peace, security, socioeconomic development and justice for all.",https://www.un.org/osaa/content/reports-and-publications,,
Office of the Special Adviser to the Secretary-General on the Prevention of Genocide,OSASG-PG,Office of the Special Adviser to the Secretary-General on the Prevention of Genocide (OSASG-PG),Yes,UN Secretariat,,Secretariat,Departments and Offices,No,USG or equivalent,Special Adviser (Acting),Virginia Gamba de Potgieter,https://www.un.org/sg/en/global-leadership/office-of-the-special-adviser-on-the-prevention-of-genocide/all,,,,,
Office of the United Nations Special Coordinator on Improving the United Nations Response to Sexual Exploitation and Abuse,OSC-SEA,Office of the United Nations Special Coordinator on Improving the United Nations Response to Sexual Exploitation and Abuse (OSC-SEA),Yes,UN Secretariat,,Secretariat,Departments and Offices,No,USG or equivalent,Special Coordinator,Christian Saunders,https://www.un.org/preventing-sexual-exploitation-and-abuse/content/un-special-coordinator-0,,,,,
Office of the Special Representative of the Secretary-General for Children and Armed Conflict,OSRSG-CAAC,Office of the Special Representative of the Secretary-General for Children and Armed Conflict (OSRSG-CAAC),Yes,UN Secretariat,,Secretariat,Departments and Offices,No,USG or equivalent,SRSG,Virginia Gamba de Potgieter,https://childrenandarmedconflict.un.org/,,,,,
Office of the Special Representative of the Secretary-General on Sexual Violence in Conflict,OSRSG-SVC,Office of the Special Representative of the Secretary-General on Sexual Violence in Conflict (OSRSG-SVC),Yes,UN Secretariat,,Secretariat,Departments and Offices,No,USG or equivalent,SRSG,Pramila Patten,https://www.un.org/sexualviolenceinconflict/,,,,,
Office of the Special Representative of the Secretary-General on Violence against Children,OSRSG-VAC,Office of the Special Representative of the Secretary-General on Violence against Children (OSRSG-VAC),Yes,UN Secretariat,,Secretariat,Departments and Offices,No,ASG,SRSG,Najat Maalla,https://violenceagainstchildren.un.org/,,,,,
United Nations Office for Disaster Risk Reduction,UNDRR,United Nations Office for Disaster Risk Reduction (UNDRR),Yes,UN Secretariat,,Secretariat,Departments and Offices,No,ASG,SRSG,Kamal Kishore,https://www.undrr.org/,,UNDRR (formerly UNISDR) is the United Nations focal point for disaster risk reduction.,https://www.undrr.org/publications?text=Annual%20Report,,
United Nations Office on Drugs and Crime,UNODC,United Nations Office on Drugs and Crime (UNODC),Yes,UN Secretariat,,Secretariat,Departments and Offices,Yes,USG or equivalent,Executive Director,Ghada Fathy Ismail Waly,https://www.unodc.org/,,The UNODC is the secretariat of the Conference of the Parties to the UN Convention against Transnational Organized Crime and of the Conference of the States Parties to the UN Convention against Corruption.,https://www.unodc.org/unodc/en/about-unodc/annual-report.html,,
United Nations Office at Geneva,UNOG,United Nations Office at Geneva (UNOG),Yes,UN Secretariat,,Secretariat,Departments and Offices,No,USG or equivalent,Director-General,Tatiana Valovaya,https://www.ungeneva.org/en,,"The UNOG services more than 8,000 meetings every year, making it one of the busiest conference centres in the world. With more than 1,600 staff, it is the biggest duty stations outside of United Nations headquarters in New York.",https://sites.ungeneva.org/annualreport/2021/,,
"Office of the High Representative for the Least Developed Countries, Landlocked Developing Countries and Small Island Developing States",UN-OHRLLS,"Office of the High Representative for the Least Developed Countries, Landlocked Developing Countries and Small Island Developing States (UN-OHRLLS)",Yes,UN Secretariat,,Secretariat,Departments and Offices,No,USG or equivalent,High Representative,Rabab Fatima,https://www.un.org/ohrlls/,,,,,
United Nations Office at Nairobi,UNON,United Nations Office at Nairobi (UNON),Yes,UN Secretariat,,Secretariat,Departments and Offices,No,USG or equivalent,Director-General,Zainab Hawa Bangura,https://www.unon.org/,,"The UNON performs representation and liaison functions and facilitates cooperation between with permanent missions, the host-country and other Governments, and intergovernmental and non-governmental organizations in Nairobi.",,,
United Nations Office at Vienna,UNOV,United Nations Office at Vienna (UNOV),Yes,UN Secretariat,,Secretariat,Departments and Offices,No,USG or equivalent,Director-General,Ghada Fathy Ismail Waly,https://www.unvienna.org/,,"The UNOV performs representation and liaison functions with permanent missions to the United Nations (Vienna), the host Government and intergovernmental and non-governmental organizations in Vienna.",,,
United Nations Youth Office,UNYO,United Nations Youth Office (UNYO),Yes,UN Secretariat,,Secretariat,Departments and Offices,No,ASG or equivalent,ASG,Felipe Paullier,https://www.un.org/youthaffairs/en,,,,,
Office of the Victims' Rights Advocate,VRA,Office of the Victims' Rights Advocate (VRA),Yes,UN Secretariat,,Secretariat,Departments and Offices,No,ASG or equivalent,Victims’ Rights Advocate,Najla Nassif Palma,https://www.un.org/preventing-sexual-exploitation-and-abuse/content/office-victims-rights-advocate,,,,,
Office of Administration of Justice,OAJ,Office of Administration of Justice (OAJ),Yes,UN Secretariat,,Secretariat,Departments and Offices (Internal Justice Bodies),No,D-2 or equivalent,Executive Director,Alayne Frankson-Wallace,https://www.un.org/en/internaljustice/oaj/,,,,,
United Nations System Chief Executives Board for Coordination,CEB,United Nations System Chief Executives Board for Coordination (CEB),Yes,UN Secretariat,Other,Secretariat,Departments and Offices (Other Entities),No,D-2 or equivalent,CEB Secretary/CEB Secretariat Director,Maaike Jansen,https://unsceb.org/,,"The CEB is the prime instrument for strengthening the coordination role of the UN inter-governnmental bodies on social, economic annd related matters.",https://unsceb.org/reports?field_mechanism[94]=94&field_report[12]=12,,
Ethics Office,EO,Ethics Office (EO),Yes,UN Secretariat,Other,Secretariat,Departments and Offices (Other Entities),No,D-2 or equivalent,Chair,Juraj Strasser,https://www.un.org/en/ethics/,,,,,
United Nations Sustainable Development Group System-wide Evaluation Office,SWEO,United Nations Sustainable Development Group System-wide Evaluation Office (SWEO),Yes,UN Secretariat,Other,Secretariat,Departments and Offices (Other Entities),No,D-2 or equivalent,Executive Director,Andrea Cook,https://www.un.org/system-wide-evaluation-office/en,,,,,
United Nations Alliance of Civilizations,UNAOC,United Nations Alliance of Civilizations (UNAOC),Yes,UN Secretariat,,Secretariat,Departments and Offices (Other Entities),No,USG or equivalent,High Representative,Miguel Ángel Moratinos Cuyaubé,https://www.unaoc.org/,,"The Alliance maintains a global network of partners including states, organizations, civil society groups, foundations, and the private sector to improve cross-cultural relations between diverse nations and communities.",https://www.unaoc.org/resource-type/unaoc-annual-reports/,,
United Nations Global Compact,UNGC,United Nations Global Compact (UNGC),Yes,UN Secretariat,,Secretariat,Departments and Offices (Other Entities),No,ASG or equivalent,CEO/Executive Director,Sanda Ojiambo,https://unglobalcompact.org/,,,,,
Counter-Terrorism Committee Executive Directorate,CTED,Counter-Terrorism Committee Executive Directorate (CTED),Yes,UN Secretariat,Other,Security Council,Subsidiary Organs (Counter-Terrorism Committee),No,ASG or equivalent,Executive Director,Natalia Gherman,https://www.un.org/sc/ctc/,,The CTC works to bolster the ability of United Nations Member States to prevent terrorist acts both within their borders and across regions.,https://www.un.org/securitycouncil/ctc/content/work-programmes,,
Implementation of Security Council resolution 2231 (2015),SC-RES2331,Implementation of Security Council resolution 2231 (2015) (SC-RES2331),Yes,UN Secretariat,Other,Security Council,Subsidiary Organs (Other),No,Not applicable,Not applicable,Not applicable,https://main.un.org/securitycouncil/en/content/2231/background,,,,,
Personal Envoy of the Secretary-General for Western Sahara,PESG-WS,Personal Envoy of the Secretary-General for Western Sahara (PESG-WS),Yes,UN Secretariat,,Security Council,Subsidiary Organs (Peacekeeping operations and political missions),No,USG or equivalent,Personal Envoy,Staffan de Mistura,https://dppa.un.org/en/mission/personal-envoy-western-sahara,,,,,
United Nations Regional Service Centre in Entebbe,RSCE,United Nations Regional Service Centre in Entebbe (RSCE),Yes,UN Secretariat,,Security Council,Subsidiary Organs (Peacekeeping operations and political missions),No,D-2,Director,Paulin Djomo,https://rsce.unmissions.org/,,"The RSCE consolidates administrative and support functions, with the goal of providing client-orientated and scalable services while reducing the missions’ footprints to UN field missions across Africa.",https://rsce.unmissions.org/un-documents,,
United Nations Logistics Base at Brindisi,UNLB,United Nations Logistics Base at Brindisi (UNLB),Yes,UN Secretariat,,Security Council,Subsidiary Organs (Peacekeeping operations and political missions),No,D-2 or equivalent,USG,Atul Khare,https://www.ungsc.org/,by UN department of operational support,"The logistics base at Brindisi provides logistic support, telecommunications and training for all peacekeeping operations around the world.",,,
"Analytical Support and Sanctions Monitoring Team pursuant to resolutions 1526 (2004) and 2253 (2015) concerning Islamic State in Iraq and the Levant (Da’esh), Al-Qaida and the Taliban and associated individuals and entities",ASMT,"Analytical Support and Sanctions Monitoring Team pursuant to resolutions 1526 (2004) and 2253 (2015) concerning Islamic State in Iraq and the Levant (Da’esh), Al-Qaida and the Taliban and associated individuals and entities (ASMT)",Yes,UN Secretariat,Other,Security Council,Subsidiary Organs (Sanctions Committee),No,Not applicable,Not applicable,Not applicable,,Entity is comprised of support staff members.,,,,
Group of Experts on the Democratic Republic of the Congo,GoE-DRC,Group of Experts on the Democratic Republic of the Congo (GoE-DRC),Yes,UN Secretariat,Other,Security Council,Subsidiary Organs (Sanctions Committee),No,Not applicable,Not applicable,Not applicable,https://main.un.org/securitycouncil/en/sanctions/1533/work-and-mandate,Entity is comprised of support staff members.,,,,
Office of the Ombudsperson established pursuant to Security Council resolution 1904 (2009),OMBUD-RES1904,Office of the Ombudsperson established pursuant to Security Council resolution 1904 (2009) (OMBUD-RES1904),Yes,UN Secretariat,Other,Security Council,Subsidiary Organs (Sanctions Committee),No,Not applicable,Not applicable,Not applicable,https://www.un.org/securitycouncil/ombudsperson,Entity is comprised of support staff members.,"The Ombudsperson gathers information and interacts with the petitioner, relevant States and organizations with regard to delisting requests and present a comprehensive report to the Security Council’s ISIL (Da'esh) and Al-Qaida Sanctions Committee.",https://www.un.org/securitycouncil/ombudsperson/reports,,
Panel of Experts on the Central African Republic,PoE-CAR,Panel of Experts on the Central African Republic (PoE-CAR),Yes,UN Secretariat,Other,Security Council,Subsidiary Organs (Sanctions Committee),No,Not applicable,Not applicable,Not applicable,https://www.un.org/securitycouncil/sanctions/2127/panel-of-experts/work_mandate,Entity is comprised of support staff members.,,,,
Panel of Experts on Haiti,PoE-Haiti,Panel of Experts on Haiti (PoE-Haiti),Yes,UN Secretariat,Other,Security Council,Subsidiary Organs (Sanctions Committee),No,Not applicable,Not applicable,Not applicable,,Entity is comprised of support staff members.,,,,
Panel of Experts on Libya,PoE-Libya,Panel of Experts on Libya (PoE-Libya),Yes,UN Secretariat,Other,Security Council,Subsidiary Organs (Sanctions Committee),No,Not applicable,Not applicable,Not applicable,https://www.un.org/securitycouncil/sanctions/1970/panel-experts/work_mandate,Entity is comprised of support staff members.,,,,
Panel of Experts pursuant to resolution 2713 (2023),PoE-RES2713,Panel of Experts pursuant to resolution 2713 (2023) (PoE-RES2713),Yes,UN Secretariat,Other,Security Council,Subsidiary Organs (Sanctions Committee),No,Not applicable,Not applicable,Not applicable,,Entity is comprised of support staff members.,,,,
Panel of Experts on South Sudan,PoE-S.Sudan,Panel of Experts on South Sudan (PoE-S.Sudan),Yes,UN Secretariat,Other,Security Council,Subsidiary Organs (Sanctions Committee),No,Not applicable,Not applicable,Not applicable,,Entity is comprised of support staff members.,,,,
Panel of Experts on the Sudan,PoE-Sudan,Panel of Experts on the Sudan (PoE-Sudan),Yes,UN Secretariat,Other,Security Council,Subsidiary Organs (Sanctions Committee),No,Not applicable,Not applicable,Not applicable,https://www.un.org/securitycouncil/sanctions/1591/panel-of-experts/work_mandate,Entity is comprised of support staff members.,,,,
Panel of Experts on Yemen,PoE-Yemen,Panel of Experts on Yemen (PoE-Yemen),Yes,UN Secretariat,Other,Security Council,Subsidiary Organs (Sanctions Committee),No,Not applicable,Not applicable,Not applicable,https://www.un.org/securitycouncil/sanctions/2140/panel-of-experts/work-and-mandate,Entity is comprised of support staff members.,,,,
Support to the Security Council Committee established pursuant to resolution 1540 (2004) on the non-proliferation of all weapons of mass destruction,SC-RES1540,Support to the Security Council Committee established pursuant to resolution 1540 (2004) on the non-proliferation of all weapons of mass destruction (SC-RES1540),Yes,UN Secretariat,Other,Security Council,Subsidiary Organs (Standing committees and ad hoc bodies),No,Not applicable,Not applicable,Not applicable,https://www.un.org/disarmament/wmd/sc1540/,Entity is comprised of support staff members.,"The Committee is tasked to report on the acilitation of national implementation activities, cooperation between organizations and effective partnerships of key stakeholders.",,,
Support to the Security Council Committee established pursuant to resolution 1718 (2006),SC-RES1718,Support to the Security Council Committee established pursuant to resolution 1718 (2006) (SC-RES1718),Yes,UN Secretariat,Other,Security Council,Subsidiary Organs (Standing committees and ad hoc bodies),No,Not applicable,Not applicable,Not applicable,,Entity is comprised of support staff members.,,,,
Office of the Special Envoy of the Secretary-General for Future Generations,OSESG-FG,,No,UN Secretariat,None,Secretariat,Departments and Offices,No,Not applicable,Special Envoy,(Vacant),https://ourfuturegenerations.com/united-nations/,,,,,
Office of the Special Envoy of the Secretary-General for the implementation of Security Council resolution 1559 (2004),OSESG-SCRES1559,,No,UN Secretariat,Other,Security Council,Subsidiary Organs (Peacekeeping operations and political missions),No,,Special Envoy,,https://dppa.un.org/en/mission/special-envoy-implementation-of-security-council-resolution-1559-2004,,,,,
United Nations Register of Damage Caused by the Construction of the Wall in the Occupied Palestinian Territory,UNRoD,,No,UN Secretariat,,Security Council,Subsidiary Organs (Peacekeeping operations and political missions),No,,Executive Director,Leonid Frolov,http://unrod.org/,,"UNRoD's mandate is to serve as a record, in documentary form, of the damage caused to all natural and legal persons concerned as a result of the construction of the Wall by Israel in the Occupied Palestinian Territory.",https://www.unrod.org/documents.htm,,
Office of the Personal Envoy of the Secretary-General for the Sudan,PESG-Sudan,Office of the Personal Envoy of the Secretary-General for the Sudan (PESG-Sudan),Yes,UN Secretariat,,Security Council,Subsidiary Organs (Peacekeeping operations and political missions),No,USG or equivalent,PESG,Ramtane Lamamra,,,,,,